SESSION,hyena_count,lion_count,note_quality,food_present,session_error_notes,notes,entry_complete,who_checked,date_checked,entered_by,entry_date,who_starts_with_food,who_ends_with_food,do_hyenas_eat,no_intx_yes_no
t6433,7,1,2,TRUE,context C. PAR in notes is called PA.,wildabeest carcass from last night. Not fresh. Last hyena lv carcass @0649. (so maybe none ends w/fd?). Lion (adult female) seen wlking on E side of Jackal hill. Hyenas first seen on S side.,TRUE,,,SSM,15-May-14,hyenas,hyenas,feed,TRUE
t64374,2,2,2,FALSE,F lions (2) are adults.,"No intx. HEX and BCA wlk, 2 lionesses so 15m - HEX. HEX and BCA don't see the lionesses until long after the observers do. They look like they are about to go near them and finally notice them and walk away.",TRUE,,,OS,19-Apr-14,,,,TRUE
t64386,23,5,2,TRUE,"F lion (1) is an adult. 4 subadults should be split into two groups: 1 subadult MALE, 3 subadult sex unknown. Hyenas: notes mention ""FOX"" one time, but it is probably just a typo for ""FOZ,"" so it can probably be ignored.","Incomplete CIs. UnIDed hyenas/lions. 2 mobs directed toward a lioness that is just so and does not respond. Carc: wildebeest (~1 hour old, don't know who killed/ate it, only that hyenas ended w/ skull in this session). Lions not seen feeding here.",TRUE,,,OS,19-Apr-14,none,hyenas,feed,FALSE
t64446,2,1,3,FALSE,F lion is an adult.,"No intx. 1 lioness so, MP so 130m - lion, OAK wlk 200m - lion.",TRUE,TMM,19-Aug-14,OS,19-Apr-14,,,,TRUE
t64477,15,8,2,FALSE,3 F lions are adults.,"Incomplete CIs. No intx. Lionss are seen 150m - PAN at beginning of session, but are never mentioned again, so I don't know if they were present for the rest of the session or not. BORDER PATROL!!!!!!!!",TRUE,,,OS,19-Apr-14,,,,TRUE
t6452,13,1,3,FALSE,SD is called SDY in notes.,"big male lion not fully mature. @0749 japanese film crew combi pull up, introduce themselves set up mtg time. @0744 FAS on UA end",TRUE,,,SSM,15-May-14,,,,FALSE
t64548,1,3,3,FALSE,3 female lions are adult.,"Complete CIs. No intx. AM312 wan snf 123m - lionesses, lionesses so. The lionesses seemed fat and were panting heavily as if they had just eaten something heavy. Two lionesses were lying on their backs with hind and fore legs from right side lifted up.",TRUE,,,OS,19-Apr-14,,,,TRUE
t64570,4,12,1,TRUE,4 female lions are adults.,"Horrible incomplete CIs b/c dark & bushes. 4-5 hyenas. No intx. Lions roaring ~4am, 4:45 lots of roaring & whooping, thinks lions killed a xebra near river. Lions = thin, if they did kill zebra must have been thin or hyenas ate it. Cant tell whos bloody.",TRUE,,,OS,19-Apr-14,,,,TRUE
t6461,5,1,2,TRUE,adult male lion,in beginning of session TZ brt stare at lion at kill. Hob 30m S of kill. 3 unID hyenas in lugga in bushes (0719),TRUE,,,SSM,15-May-14,lions,hyenas,feed,TRUE
t64651,21,6,2,TRUE,F lion is an adult.,"Incomplete CIs. Carcass: remaining pieces of what was probably an impala or tommie (only a few scraps left). BORDER PATROL!!!!!!! No intx. Three hyenas are fat, two are bloody. Lions not mentioned again after 6:33",TRUE,,,OS,19-Apr-14,hyenas,none,feed,TRUE
t65,4,2,3,FALSE,lionesses are adult,LG and CSL lv in the beginning of session. No intx.,TRUE,,,SSM,11-Jun-14,,,,TRUE
t65063,9,3,3,FALSE,Lionesses (3) are adults.,"No intx.  Border patrol (FOZ in lead). Lionesses first seen at 0706, so in bushes 20m - MRPH, hyenas don't seem to notice them. Hyenas pasting. Topi chases MRPH FOZ. Complete CIs.",TRUE,TMM,14-Mar-14,OS,13-Mar-14,,,,TRUE
t65338,20,1,3,TRUE,"Age of lioness was adult; add into notes that she was fat, bloody.","No intx. Carcass: adult topi (head, half of backbone, and part of leg remain). Incomplete CIs. Many hyenas are fat. 6+ hyenas are bloody, lioness is bloody too. Lioness first seen at 1738, so 170m - carcass.",TRUE,,,OS,13-Mar-14,hyenas,hyenas,feed,TRUE
t65409,1,1,3,TRUE,Lioness is an adult.,"No intx. Complete CIs. Carcass: adult topi, fresh kill. SBL wlk arr at 1842, poop, vomit, roll vomit, vomit, and st/lk 60m - kill.",TRUE,,,OS,13-Mar-14,lions,lions,no,TRUE
t65510,1,2,2,FALSE,,"No intx. At start of session, JUBA wlk snf, 2 male lions so 70m - JUBA. At 0648, JUBA goes oos bushes.",TRUE,,,OS,13-Mar-14,,,,TRUE
t65532,11,8,1,FALSE,2 M lions and 3 F lions are adults. Also add another unID.,"Incomplete CIs due to darkness. Two adult male lions present at beginning of session, as are 11 hyenas.",TRUE,TMM,14-Mar-14,OS,13-Mar-14,,,,FALSE
t65544,29,1,2,TRUE,"Add unID + unIDed cub. Lioness is an adult. Note that the lioness is fat, bloody.","Incomplete CIs. Many hyenas are bloody, and lioness is bloody too. Lioness is present at beginning of session, lv wlk - S 20m - carcass.",TRUE,TMM,14-Mar-14,OS,13-Mar-14,hyenas,hyenas,feed,FALSE
t6564,20,3,3,FALSE,,all three lions present throughout the session. All are subadult males. Though only 1 lion is interacting with hyenas other 2 are so and are not mentioned until end of session.,TRUE,,,SSM,15-May-14,,,,FALSE
t65664,3,1,3,FALSE,Lioness is an adult.,"No intx. Complete CIs. ROOS, MIG, JUBA all so. JUBA so 120m - ROOS, MIG so 100m - ROOS. Lioness so 18m - ROOS.",TRUE,TMM,14-Mar-14,OS,13-Mar-14,,,,TRUE
t66,6,1,1,TRUE,,400m away from den. Lion ( unknown age/sex) wlk N away from wildabeest kill. No intx.,TRUE,,,SSM,11-Jun-14,hyenas,hyenas,feed,TRUE
t6626,4,4,3,TRUE,,at the end of the session hyenas are disturbed by trans worl balloon landing,TRUE,,,SSM,16-May-14,lions,lions,no,FALSE
t66369,2,5,3,TRUE,2 female lions with age unlisted are adults.,"Complete CIs. No intx. Carcass: subadult cow. All lions are feeding on carcass, GUCI st/lk 200m - carcass, FEL so/lk 215m - carcass.",TRUE,,,OS,16-Mar-14,lions,lions,no,TRUE
t66407,22,3,2,FALSE,,Some incomplete CIs due to lighting conditions and bushes. 2 hyenas were bloody.,TRUE,TMM,18-Mar-14,OS,16-Mar-14,,,,FALSE
t66419,21,3,2,TRUE,,"Incomplete CIs. Carcass: wildebeest (very little meat left, mostly comprised of the spine, some ribs, and the tail). No hyenas or lions were noted as being bloody. Lions never got carcass during session. OAK was darted right after the session ended.",TRUE,,,OS,16-Mar-14,hyenas,none,feed,FALSE
t66446,2,4,2,FALSE,One of the four lions was an adult female.,"No intx. Complete CIs. NAV wlk - E, RAV st/lk 70m - NAV; lions were walking towards the South almost 80m - hyenas. Also, a black rhino with a calf was seen.",TRUE,TMM,02-Apr-14,OS,15-Mar-14,,,,TRUE
t66471,18,2,1,FALSE,M lion is actually a young ADULT. F lion is an adult. Add 2 to UNIDHYENAS.,"Incomplete CIs and IDs. Hyenas mob lions! Not all hyenas present were listed, so there were actually more than 18 present.",TRUE,TMM,18-Mar-14,OS,16-Mar-14,,,,FALSE
t6665,8,6,3,FALSE,,male lion is big with a black mane. Multiple heyenas poop during this session. Only find DJ sample.,TRUE,,,SSM,16-May-14,,,,FALSE
t6679,7,5,2,FALSE,,0754:HG [st/lk] twd 5 lionesses so on S side on den1 crk50 m S of creek.(no distance given) 0757:dj and sy lope arr across plains from NE toSW. At same time lionesses get up app 13LEand so in bushes.,TRUE,,,SSM,16-May-14,,,,TRUE
t6699,2,1,3,FALSE,,unsure of context lion stays about 75m away from den,TRUE,,,SSM,15-May-14,,,,FALSE
t671,20,3,2,FALSE,,"FAS on KBK 0722-0820.  FAS on HD 0732-end, FAS on UA and B 0734-end. 1 adult female lion and ""2 little guys"" (her cubs)",TRUE,,,SSM,20-Jun-14,,,,FALSE
t67174,2,3,3,FALSE,,"Complete CIs. No intx. All 3 lions are bloody. ALI wlk - S 53m - lions, DRA st/lk 34m - lions; DRA was a bit excited about the lions, then he loped towards the south after ALI.",TRUE,,,OS,16-Mar-14,,,,TRUE
t6748,1,7,2,FALSE,lions are adult.,4 males and 3 female lions so with combies watching. BSH arr lope 50m W of lions continues loping off NW.,TRUE,,,SSM,16-May-14,,,,TRUE
t67607,5,2,3,FALSE,2 F lions are adults.,Mostly complete CIs. One mobbing event. Three unIDs left at beginning of session. SRN is bloody.,TRUE,TMM,18-Mar-14,OS,16-Mar-14,,,,FALSE
t67623,18,7,3,FALSE,"Add LAV to IDs present. Also, it is possible that one of the females was just the subadult male (identified incorrectly one time?).",Mostly complete CIs. 3 adult F and 1 subadult M lion present at beginning of session. Mobbing! Lost sight of hyenas at 7:20 to follow lions.,TRUE,TMM,18-Mar-14,OS,16-Mar-14,,,,FALSE
t67624,13,1,2,FALSE,Sex of lion was never specified in the notes.,"Incomplete CIs. No intx. Prior to arrival of lion, hyenas are all so, wan or wlk.",TRUE,TMM,02-Apr-14,OS,16-Mar-14,,,,TRUE
t67637,1,1,3,TRUE,Lion is an adult.,"Complete CIs. No intx. Carcass: adult wildebeest (front intact only). Believe the lion made the kill. Lion 3m - kill. BAEZ seemed oblivious of the kill, then  became aware and spent lots of time looking excited twd it but not venturing close or whooping.",TRUE,,,OS,16-Mar-14,lions,lions,no,TRUE
t67745,5,1,3,FALSE,Lion is an adult.,"Complete CIs. No intx. MONO and JUNO are injured. unID may be MONO. All hyenas are so, lioness so 110m - JUNO.",TRUE,,,OS,16-Mar-14,,,,TRUE
t67756,6,1,2,TRUE,Lion is an adult.,"Incomplete CIs. Carcass: remnants of mostly grown buffalo. Mobbing! JUNO has a very slight limp. Lion is limping badly. There was a Maasai with a group of 25-30 cattle about 120m - carcass at one point, and it seemed to concern them.",TRUE,,,OS,16-Mar-14,none,hyenas,feed,FALSE
t6776,5,4,2,FALSE,,notes do not have any gender symbol simply says lions. At beginning of session 4 lions leaving scene walking S.,TRUE,,,SSM,16-May-14,,,,TRUE
t67763,32,4,1,TRUE,I believe the 2 F lions are adults.,"Incomplete CIs because of bushes and darkness. Carcass: cow (head, ribs, skin, and legs).",TRUE,,,OS,18-Mar-14,lions,hyenas,feed,FALSE
t67880,20,1,2,FALSE,F lion is an adult. Add MOS to IDs present.,"Incomplete CIs because of bushes. Multiple mob events [verified that they are mobs with observer (Kenna)].At the beginning of the session, the lion is in the bushes.",TRUE,TMM,02-Apr-14,OS,18-Mar-14,,,,FALSE
t67916,6,2,2,TRUE,"A carcass is present, so the context should be c.","Mostly complete CIs. No intx. Carcass: buffalo carcass (partially eaten, over half still intact). Lions are on opposite side of bushes from hyenas. Carcass 20m - lion. Many tourist vehicles near lions.",TRUE,,,OS,18-Mar-14,none,none,no,TRUE
t67921,1,1,2,FALSE,F lion is an adult.,"No intx. ARG lope - W, 1 lioness present.",TRUE,,,OS,18-Mar-14,,,,TRUE
t68053,1,3,3,FALSE,3 lions are adults.,"Complete CIs. ""TAB appears to either be following the lions to keep an eye on them, or is trying to integrate herself into the pride. I think she thinks she's a lion. She should be more afraid since there don't appear to be any other hyenas around…""",TRUE,,,OS,18-Mar-14,,,,FALSE
t68074,5,3,3,FALSE,3 F lions are adults.,All hyenas are st/lk or so 40+m from the lionesses.,TRUE,,,OS,18-Mar-14,,,,TRUE
t68344,1,1,2,FALSE,F lion is an adult,Incomplete CIs. No intx. Distance between hyenas and lion not given. HEX so.,TRUE,TMM,02-Apr-14,OS,18-Mar-14,,,,TRUE
t68365,2,1,3,FALSE,F lion is an adult.,Complete CIs. No intx. All three animals are so. Hyenas are 41+m away form lioness.,TRUE,,,OS,18-Mar-14,,,,TRUE
t6840,1,6,1,TRUE,no end time listed in notes. 16:04,"lioness killed subadult warthog, she and 5 other lions (unknown age/sex) fd on it. Lone hyena apperars and lurks about.",TRUE,,,SSM,16-May-14,lions,lions,no,TRUE
t68432,2,9,2,TRUE,"One of the lions is an adult male, the other 8 are unknown (but not all 9).","No intx. Carcass: fresh topi (scraps only). Adult male lion is grooming self, other lions are feeding, and hyenas wlk - SE.",TRUE,,,OS,18-Mar-14,lions,lions,no,TRUE
t68488,1,1,3,FALSE,F lion is an adult.,Complete CIs. No intx. NAV st/lk 127m - lioness so.,TRUE,,,OS,18-Mar-14,,,,TRUE
t68701,1,1,3,FALSE,F lion is an adult.,"Complete CIs. No intx. ROOS so in middle of road, lioness so 80m - ROOS. Observer's presence was drawing lion's attention to ROOS, so observer left.",TRUE,,,OS,19-Mar-14,,,,TRUE
t68743,9,2,3,TRUE,2 F lions are adults.,"Some incomplete CIs. No intx. Hyenas feed on old kill 50+m - lions, lions are so. Jackal was barking. UnID1 chased a tommie 250m - lions.",TRUE,TMM,02-Apr-14,OS,18-Mar-14,hyenas,hyenas,scraps,TRUE
t68867,4,2,3,FALSE,"M lion, F lion, and both jackals are all adults.",Complete CIs.,TRUE,,,OS,18-Mar-14,,,,FALSE
t68911,3,1,2,FALSE,F lion is an adult.,"Incomplete CIs. No intx. Hyenas wlk, lioness so.",TRUE,,,OS,18-Mar-14,,,,TRUE
t68931,7,1,3,FALSE,F lion is an adult.,"Comeplete CIs. No intx. Hyenas are so, lioness is over 100m away.",TRUE,,,OS,18-Mar-14,,,,TRUE
t68937,1,3,3,FALSE,,Complete CIs. No intx. FFL wlk - SE 47m - lions,TRUE,,,OS,18-Mar-14,,,,TRUE
t69037,12,2,2,TRUE,"End time is 10:15. F lion was an adult. M lion was referred to as ""he,"" but sex was never actually specified -- leave as unknown.","Incomplete CIs. Carcss: adult buffalo (1/2 of vertebral column, part of rib, and head). @ start lions have carcass but hyenas have scraps.",TRUE,TMM,02-Apr-14,OS,18-Mar-14,lions,hyenas,feed,FALSE
t69126,1,1,3,FALSE,F lion is an adult.,Complete CIs. No intx. TAB so 8m - lioness so.,TRUE,,,OS,18-Mar-14,,,,TRUE
t69173,23,6,1,TRUE,,"Incomplete CIs due to tall grass (very bad). Many hyenas unIDed (at least 23 total). Carcass: buffalo. One group of lions starts with carcass, other lions arrive and take it. Lion almost catches FOZ. Hyenas are all gone by end of session.",TRUE,,,OS,18-Mar-14,lions,lions,scraps,FALSE
t69255,1,5,3,FALSE,All lions are adults.,Complete CIs. No intx. BLUE st/lk 39m - lions.,TRUE,,,OS,18-Mar-14,,,,TRUE
t69384,39,3,2,TRUE,Add KTO to IDs present. End time is 18:59. 3 lions are male.,"Incomplete CIs. Carcass: adult Topi. Hyenas are bloody, lions are not bloody, hyenas may have made kill. Hyenas mob lions twice. Lions never get carcass. Hyenas successfully mob lions to defend carcass.",TRUE,,,OS,18-Mar-14,hyenas,hyenas,feed,FALSE
t6946,1,5,2,FALSE,,"1k W of balloon tree. SX so . 50m S of SX 5 lionesses so. ""neither sx or lions care about the others presence. """,TRUE,,,SSM,16-May-14,,,,TRUE
t69528,2,4,2,FALSE,All 4 lions are adults.,"No intx. At beginning of session, GUCI so 97m - lions. FFL is first seen at 1746 stl/lk 90m lions.",TRUE,TMM,02-Apr-14,OS,23-Mar-14,,,,TRUE
t69549,4,1,3,TRUE,Lion is an adult.,"Food was one scrap, which GUCI fed on at 1810.",TRUE,,,OS,23-Mar-14,hyenas,none,scraps,FALSE
t69604,23,1,1,TRUE,I think there should only be 1 unID? I may be wrong though.,"Incomplete CIs for entire session, many events and IDs not included. Carcass: topi. 2 mobbing events! Lion makes contact with two hyenas, but both escape safely. One hyena steals a scrap. No one (hyena or lion) is noted as bloody. Hyena jumps over lion!",TRUE,,,OS,23-Mar-14,lions,lions,scraps,FALSE
t69651,2,9,3,FALSE,,Mostly complete CIs. All individuals are present at beginning of session.,TRUE,,,OS,23-Mar-14,,,,FALSE
t69678,5,1,3,FALSE,Add TAB to IDs present!,No intx. No details given at all (about lion-hyena distance or lion activity).,TRUE,,,OS,23-Mar-14,,,,TRUE
t69755,1,1,3,FALSE,,Complete CIs. No intx. CHIT wan snf 90m - lion.,TRUE,TMM,02-Apr-14,OS,23-Mar-14,,,,TRUE
t69760,3,1,3,TRUE,,"No intx. Carcass: spinal cord and skull, species N/A.  All individuals present at beginning of session. No one (hyena or lion) is noted as being bloody. Lion fd at carcass while hyenas are so ~80m away. 33 vultures and 2 maribu storks are here too.",TRUE,,,OS,23-Mar-14,lions,lions,no,TRUE
t6977,1,2,3,FALSE,,Courting lions from a.m.,TRUE,,,SSM,16-May-14,,,,TRUE
t69794,1,4,3,FALSE,,"No intx. LU lopes around buffalo herd when she arrives. LU st/lk 150m - lions (so), then app 60m - lion, then walks off.",TRUE,,,OS,23-Mar-14,,,,TRUE
t70073,2,1,3,FALSE,Lion is an adult.,Complete CIs. Lion never moved a muscle; it's either lazy or dead.,TRUE,,,OS,23-Mar-14,,,,FALSE
t70078,10,1,2,TRUE,"Add to notes for lion: ""large, injured.""",Incomplete CIs b/c of darkness and crazy hyenass. Carcass: zebra (head and little bit of spinal cord remain). At least three hyenas are bloody; lion is not noted as being bloody. Lion has very fresh chunk taken out of his left butt cheek.,TRUE,TMM,02-Apr-14,OS,23-Mar-14,hyenas,lions,feed,FALSE
t70141,36,3,1,TRUE,,"Incomplete CIs. Carcass: adult wildebeest (large wildebeest herd within sight). 2 hyenas are bloody. One successful mobbing event and then the lions leave! Therefore, no intx after lions leave.",TRUE,,,OS,23-Mar-14,lions,hyenas,feed,FALSE
t70179,18,3,2,TRUE,,Carcass: adult wildebeest. Two mobbing events! 6+ hyenas are bloody. Hyenas never had possession of the kill and the subadult male lion never left the kill. Hyenas find scraps left behind after lion carries carcass away.,TRUE,,,OS,23-Mar-14,lions,lions,scraps,FALSE
t70184,9,1,3,TRUE,,Carcass: leftover adult wildebeest carcass (from session 70179).,TRUE,,,OS,23-Mar-14,hyenas,hyenas,scraps,FALSE
t708.5,3,9,2,TRUE,start time 1735 end time 1809. CHOC is CH in notes,2 lionesses lead 7 cubs to freshly killed gnu. Hyenas a few hundrend meters away. Hyenas are by den. No intx.,TRUE,,,SSM,20-Jun-14,lions,lions,no,TRUE
t7081,10,1,2,FALSE,KL is noted as KAL and RM is noted as RUM,hyenas look chubby.,TRUE,,,SSM,16-May-14,,,,FALSE
t7124,1,1,1,FALSE,date should be june 4th. No time on this entry.,Ras were in Nairobi for 4 days. Tyson saw COCH and lioness starring at each other NE of Bab tree,TRUE,,,SSM,16-May-14,,,,TRUE
t71475,10,2,2,TRUE,2 lionesses are adults. Change context: there is a scrap present.,"There is one scrap present, which ENVY fd on at 1903 (over 50m - lions).",TRUE,,,OS,23-Mar-14,hyenas,none,scraps,FALSE
t71681,20,3,2,TRUE,"3 F lions are adults. There are 5 unIDs, not 4.","Incomplete CIs. Carcass: wildebeest skull with some skin and meat on it. Observers specify that no hyenas are bloody, but do not note whether or not lions are bloody. 3 Mobbing events take place. Hyena steals the carcass from the lions!",TRUE,TMM,02-Apr-14,OS,25-Mar-14,lions,hyenas,feed,FALSE
t72105,3,2,3,FALSE,,"Only intx is when HEX first sees lions, ""freaks out"" and lopes around them.",TRUE,,,OS,25-Mar-14,,,,TRUE
t7219,3,,1,FALSE,PYG is referred to as Pygmy in notes,hyenas are cubs. Lions heard close by in bushes. All 3 cubs run back into den.,TRUE,,,SSM,16-May-14,,,,TRUE
t72258,3,2,3,FALSE,,Complete CIs.,TRUE,,,OS,25-Mar-14,,,,FALSE
t72266,10,2,2,FALSE,,Incomplete CIs.,TRUE,,,OS,25-Mar-14,,,,FALSE
t7228,9,2,2,TRUE,missing GER and RCN in hyena list. HK is noted as HULK,"find 2 unID hyenas and name them,immigrant male ROCKY (ROCK) and female ADRIENNE (ADR). Get video. Find lions eating adult topi. No lions or hyenas are bloody",TRUE,,,SSM,19-May-14,lions,lions,no,FALSE
t72320,41,3,2,TRUE,"IDs present: jun-->juno; 5 uniDs + mos?, not 8 unID + mos? (so total of 6 total unIDs); and add MP, AQUA, MRPH, and OBAM. Also, 2 F lions are adults.","Incomplete CIs. Type of carcass is not specified. Hyenas mob lions and successfully push lions off kill. After feeding, the hyenas leave the kill on their own accord (around 07:32). Also, WRWK is limping.",TRUE,,,OS,26-Mar-14,lions,none,feed,FALSE
t7242,2,1,2,FALSE,,adult male lion seen between palm lugga and ball tree. OT and RV so 5m apart. RV is darted.,TRUE,,,SSM,16-May-14,,,,TRUE
t72442,41,2,3,FALSE,remove puma from unIDhyenas,"1 lioness, 1 sub-adult male lion, no food",TRUE,,,TMM,24-Feb-19,,,,FALSE
t72506,1,17,2,TRUE,"10 ""juvenile"" lions --> 10 ""cubs."" 5 F lions and 2 M lions are adults.","Field notes do not state whether or not the lions are on the kill, just that lions are there and kill is there. Carcass: fairly fresh buffalo kill. No intx. Lions present at start of session, JUBA first seen at 18:55 so 80m - lions, then wan 80m - lions.",TRUE,TMM,02-Apr-14,OS,25-Mar-14,lions,lions,no,TRUE
t72524,15,14,3,TRUE,"5 F lions are adults; maybe add to notes that 8 juveniles are ""cubs.""","Very foggy! No intx. Carcass: buffalo. When first seen, lions are feeding on kill. Hyenas do not interact with lions, but rather just wait for them to finish from 100-220m away (all hyenas in sight are so).",TRUE,,,OS,25-Mar-14,lions,lions,no,TRUE
t72826,3,2,1,FALSE,,Incomplete CIs due to darkness. PARC had slight limp. No details at all given on lion-hyena intx. No intx.,TRUE,,,OS,25-Mar-14,,,,TRUE
t72963,7,1,2,TRUE,Lion is an adult.,"Incomplete CIs due to darkness. Carcass: tommie. No intx. No details on lion-hyena intx/distance given. Observers may have changed location at 19:17 (so lioness may not be in session anymore starting at 19:17, I'm not sure though).",TRUE,,,OS,25-Mar-14,hyenas,hyenas,feed,TRUE
t73124,25,20,2,TRUE,"12 juvenile lions: maybe add ""cubs"" to notes. At least one of females is an adult.","Incomplete CIs. Carcass: adult wildebeest. 18 lions are present at beginning of session, hyenas are not. Hyenas steal scraps from lions, jackals, and each other. Lions leave carcass on own accord and then hyenas take over carcass.",TRUE,,,OS,27-Mar-14,lions,hyenas,feed,FALSE
t73151,2,4,2,TRUE,Context is incorrect! There is a buffalo carcass present. All lions are adults.,Incomplete CIs. Carcass: buffalo. No intx. No details given on intx/distance of lions-hyenas.,TRUE,TMM,02-Apr-14,OS,27-Mar-14,lions,lions,no,TRUE
t732.4,1,1,2,FALSE,GYP is GY in notes,"200m W of den lioness wlks, hyena flee from her. No intx.",TRUE,,,SSM,20-Jun-14,,,,TRUE
t733,25,1,2,TRUE,hol not present,FAS on KBK 0657-0750.  kill but don’t specify what it is. Hyenas bloody. Cant find holly but hand writing unclear so possible mistake.,TRUE,,,SSM,21-Jun-14,hyenas,hyenas,feed,FALSE
t74336,1,3,3,TRUE,,No intx. Carcass: full grown wildebeest. 3 lions fd kill while NIKK so 100m - lions. NIKK has a right C slit and a limp on the back leg.,TRUE,,,OS,27-Mar-14,lions,lions,no,TRUE
t74551,30,1,2,FALSE,ACON has a piece of food and is carrying it; does this change the context?,"Incomplete CIs starting @ 7:52. Hyenas & lioness are present @ beginning of session. Hyenas wlk in 2 groups from same direction (probably kill, but observers couldn't find carcass). Many hyenas  bloody. ACON lope w/ food. No intx. Lioness wlk 100m - JUNO.",TRUE,,,OS,27-Mar-14,,,,TRUE
t74674,28,1,2,TRUE,,"Food: bones. Hyena steals scrap, lion leaves, and hyenas chase/follow him away.",TRUE,,,OS,27-Mar-14,lions,none,scraps,FALSE
t74888,3,1,3,TRUE,,Complete CIs. Carcass: freshly killed wildebeest. One hyena steals a scrap from the lion. Two hyenas mob the lion once.,TRUE,TMM,02-Apr-14,OS,27-Mar-14,lions,none,scraps,FALSE
t75684,2,6,3,TRUE,,"Carcass: maybe a small antelope (only scraps, bones and blood remain). Both hyenas are bloody, so it appears as though the hyenas made the kill and the lions stole it from them. COUS has two healing bite wounds.",TRUE,TMM,19-Aug-14,OS,12-May-14,lions,hyenas,no,FALSE
t75951,48,11,2,TRUE,"Add to IDs present: TPE, ADON. Add to unIDs: TITN?",Incomplete CIs. Carcass is never identified. Hyenas mob subadult male lion 3 times. Observers left the lions from 6:46 to 6:53 to concentrate on hyenas leaving group.,TRUE,,,OS,12-May-14,,,scraps,FALSE
t7598,20,1,2,TRUE,Starting time not noted. BERN is noted as BER and JJ is noted as JUJU,hyenas bloody. Just after dark fresh adult wildabeest kill. Hyenas bloody. Lion is only mentioned briefly in this session.,TRUE,,,SSM,17-May-14,hyenas,hyenas,feed,FALSE
t76041,3,12,3,FALSE,,"At beginning of session, all 12 lions are traveling and ARG is so 50m - lions. One lion repeatedly chases AMAZ. Right before lions leave, SWIL briefly follows them as they are travelling.",TRUE,,,OS,12-May-14,,,,FALSE
t76330.1,19,3,2,TRUE,Add to unIDs: 4. Add to predators: 2 jackals.,"No intx. Carc: fresh zebra carcass. Lions are feeding, hyenas are just wandering about 50m away from the lions trying to wait to steal the carcass. The four unIDs are hiding in the bushes (there may be more).",TRUE,,,OS,12-May-14,lions,lions,no,TRUE
t76598,1,5,2,TRUE,,"Lions killed 4 cows (only 2 carcasses are visible, but observers heard from guys in camp that total of 4 were killed); 1 carcass is 3/4 eaten & 1 is mostly intact. Cow herders chased the lions off the carcass. unIDadult first seen 250m - lions at 16:38.",TRUE,,,OS,12-May-14,none,none,no,TRUE
t76692,1,2,3,FALSE,,"No intx. NVSH st/lk, 2 lions resting 300m - NVSH.",TRUE,TMM,19-Aug-14,OS,25-May-14,,,,TRUE
t76694,1,2,3,FALSE,,"No intx. NVSH wan, 2 lions resting 250m - NVSH. Observers leave at 17:45.",TRUE,,,OS,25-May-14,,,,TRUE
t76723,2,1,3,FALSE,,"No intx. 1 lioness travelling, OAK wlk 120m - lioness. SWIL first seen at 17:58 wlk 120m - lioness. Observers leave at 18:00.",TRUE,,,OS,25-May-14,,,,TRUE
t76744,1,3,3,FALSE,,"No intx. 3 lions travelling. TILT first seeb at 6:20, lope 170m - lions. Observers leave at 6:20.",TRUE,,,OS,25-May-14,,,,TRUE
t76926,1,1,3,FALSE,Female lion is an adult.,"At start of session, EIN so and lioness resting 80m - EIN. At 18:00, EIN app 25m - lioness, ignore.",TRUE,,,OS,25-May-14,,,,FALSE
t77022,1,4,3,FALSE,,"No intx. ART? wlk, 4 lions resting 100m - ART?",TRUE,TMM,19-Aug-14,OS,25-May-14,,,,TRUE
t77099,18,6,2,TRUE,,"Incomplete CIs. Mobs! STUFFED LION EXPERIMENT. 1 whole sheep used as bait. Lions and hyenas feed on sheep. TURQ has small injuries and a snare on her neck, but came off on its own later.  Observations were paused 07:17-08:17 to dart OBAM and remove snare.",TRUE,,,OS,25-May-14,lions,,feed,FALSE
t77224,39,2,2,FALSE,"IDs present: add ATAC. UNIDs: add ""unIDcollared.""","Incomplete CIs (because there are so many hyenas). At 6:57, a different set of observers (in a separate vehicle) took over recording the session. Multiple mob events take place! A couple of times, a single hyenas pastes (p=lions).",TRUE,,,OS,25-May-14,,,,FALSE
t77237,18,3,2,TRUE,,"Incomplete CIs. No intx. Carc: adult buffalo (spinal cord, pelvis, head). Tourists said the buffalo was killed by a lion that morning, by 1pm hyenas had taken carc, and that many of the lions here earlier had fresh wounds. Lioness has a fresh wound.",TRUE,,,OS,25-May-14,hyenas,hyenas,feed,TRUE
