SESSION,hyena_count,lion_count,note_quality,food_present,session_error_notes,notes,entry_complete,who_checked,date_checked,entered_by,entry_date,who_starts_with_food,who_ends_with_food,do_hyenas_eat,no_intx_yes_no
t11588,1,3,3,FALSE,"I am not sure these male lions should be called adults. They are called adults in this session, but it also says they are the same lions as in session 11587.4, where it is noted that they are just beginning to grow manes. I would call them subadults",JAB just so 50m - lions (so),TRUE,,,JMP,14-Mar-14,,,,TRUE
t11649,1,2,3,FALSE,,Track BAIL to where she is wlk - W 150m - lions (st/lk),TRUE,,,JMP,14-Mar-14,,,,TRUE
t11656.3,2,3,3,FALSE,,"OT so, POS so 75m - OT, lions so 30m - OT",TRUE,,,JMP,14-Mar-14,,,,TRUE
t11661.4,1,3,3,FALSE,,OT wlk - N @60m NE - Spider Web T; lions so 30m NW - Spider Web T,TRUE,,,JMP,14-Mar-14,,,,TRUE
t11751,3,3,3,FALSE,"These male lions are maneless, and thus are subadults","Lions here at start: 1 sub male lion sit, 1 sub male lion st/lk, 1 adult female lion wlk - NW 150m - male sub lions. Hyenas (2 st/lk, 1 wlk) 50m - sub male lions",TRUE,,,JMP,14-Mar-14,,,,FALSE
t11891,5,1,2,TRUE,,"Food present = zebra skull. 300m away is a zebra kill, which obs think the Talek Clan killed (couple fat, bldy hyenas in previous kill session). Lion fd zebra skull 40m - hyenas. ZULU very bloody. FN fat. Incompl CI's (bushes). Lion abandons food",TRUE,,,JMP,14-Mar-14,lions,hyenas,feed,FALSE
t1190,30,2,3,TRUE,BSH is BRSH in notes,"clan war! ~7 OL. L hyenas. In the war no actual contact just a lot of noise, rushing eachother, and st face eachother. Kill is adult gnu  talek displace OL. FAS on AP 0721-0732. FAS LH 0744-0804. no real intx.",TRUE,,,SSM,21-Jul-14,lions,hyenas,feed,TRUE
t11943.1,1,1,2,FALSE,,"Lion wlk - W and unID hyena flw 100m - lion. That's it, no age/sex given for lion",TRUE,,,JMP,14-Mar-14,,,,TRUE
t1198.1,2,2,2,FALSE,,"23s [st/lk] at 2 big male lions wlking 1km away SE, hyenas wlk W. no intx.",TRUE,,,SSM,07-Jul-14,,,,TRUE
t1209,11,6,2,TRUE,"missing MW, BSH is BRSH and HOL is HOLLY in notes",zebra carc.6 lions don’t know age or sex only know that one is an adult lioness. Hyenas fding on carc is not directly stated but they app it. Hard to read notes.,TRUE,,,SSM,07-Jul-14,lions,hyenas,no,FALSE
t1213,14,,2,FALSE,JE is JF in notes,FAS on PP and BM 0637-0707. lion/s roar east of scene @700 BM look twd sound.,TRUE,,,SSM,07-Jul-14,,,,TRUE
t12172,1,3,3,FALSE,,Track LG wan/snf,TRUE,,,JMP,14-Mar-14,,,,FALSE
t12214,7,10,2,TRUE,"Context should be ""k""","In CIs until ~0630.Lns ""almost certainly been there since we first arrived.""2 lrge sep patches bld & rumen, 1 v close to 2 m lns, other ~50m-them.Hys get topi horns, so has been a topi kill. Think hys made kill,lns attcted once mostly eaten. #lns=minimum",TRUE,,,JMP,14-Mar-14,lions,hyenas,scraps,FALSE
t1238,2,6,2,TRUE,ZIP is zipper in notes and QUAI is quail in notes.,"gnu kill. 6 lions total, lionesses and big cubs don’t know how many of each. Hard to read notes. No real intx.",TRUE,,,SSM,07-Jul-14,lions,lions,scraps,TRUE
t12433,1,2,2,FALSE,"JAB should not be in the IDs present; rather, JAB? should be in UNIDHYENAS. The N ID Hyenas should be 0","Incomplete CI sampling - observe from a den at a distance. JAB? emerge from lugga and wlk - E. Next minute lions emerge from same lugga ~50m - where JAB? emerged, and ~100m from where she is now. Lions go oos, then JAB? goes oos",TRUE,,,JMP,14-Mar-14,,,,TRUE
t1245,1,2,2,TRUE,SHER is SH in notes,FAS on SHER 0716-0726. lion hill- gnu carcass,TRUE,,,SSM,07-Jul-14,lions,lions,no,FALSE
t1247,10,,2,FALSE,,"@1811 FG and Dg orient twd distant lion roars st/lk. Lions never seen only heard. FAS FG,DG,MU,BB,Q 1800-1830. no intx.",TRUE,,,SSM,07-Jul-14,,,,TRUE
t12504,6,2,3,FALSE,,GER fat. No intx outside of the hyenas being interested in the lions/watching them. 2 combis arrive at 0720,TRUE,,,JMP,14-Mar-14,,,,TRUE
t127.2,4,3,2,FALSE,PEG is pegasus in notes,hyenas lie on hill 200m away from lions (unknown age/sex). No intx.,TRUE,,,SSM,11-Jun-14,,,,TRUE
t1287,3,1,2,TRUE,,young zebra carcass. No real intx.,TRUE,,,SSM,07-Jul-14,lions,hyenas,feed,TRUE
t12927,2,2,2,FALSE,,"SEIN a bit bloody. Lions here when arr. Lioness has large, fresh wound on left hip/buttock. No CI's or scans b/w 0750 and 0802, so not sure what happened then. Same b/w 0802-0813",TRUE,,,JMP,14-Mar-14,,,,FALSE
t12939,8,3,3,TRUE,,"when arr, male lion & female lion - these 2 possibly mating pair - here, and another male lion feed adult gnu kill 60m - them and 50-80m - hyenas (st/lk / wan/snf / so). WALD fat & bloody",TRUE,,,JMP,14-Mar-14,lions,hyenas,feed,FALSE
t13099,32,1,1,TRUE,,"fresh young gnu kill (carc still mostly intact). Incomplete CI's. ""FA and/or DD [prob] made the kill, most likely FA but no way to guess for certain."" These 2 feed alone when arr. Some of fisi who arr later are fat. Almost certain lion same as in 13101",TRUE,,,JMP,14-Mar-14,hyenas,lions,feed,FALSE
t13101,19,1,2,TRUE,"GOB circled twice in notes (both times at 0637). MIKE also circled twice (0637 and 0646). Notes say 3-5 unIDs wlk oos (0631), so I put the # hyenas was 19 instead of 21 by rule of parsimony","When arr, lion so on road 80m S - hyenas. Kill scene, but nothing really left of the carcass. Hyenas st/lk / walk / carry little scraps. In CI's (bushes). 2 hyenas bloody, 3 fat. No CI's 0655-0658",TRUE,,,JMP,14-Mar-14,hyenas,hyenas,scraps,FALSE
t1311,1,2,2,TRUE,,leg bone and something else small to eat. No real intx.,TRUE,,,SSM,07-Jul-14,hyenas,hyenas,scraps,TRUE
t13174,29,1,2,TRUE,"Several hyenas circled twice in notes, both in initial scan and later when noted as first seen","Incomplete CI's (many fisi). adult gnu kill. At least 20 hyenas present upon arrival, and 1 young maneless male lion st/lk 50m - carcass (lvs same minute). unIDhyena slightly bloody and LG bloody. No CI's 0649-0652 (moving)",TRUE,,,JMP,14-Mar-14,hyenas,hyenas,feed,FALSE
t13412.2,1,1,3,FALSE,,"Track BP st/lk, subadult or female lion runs oos into DOC 50m - BP, BP lv - S",TRUE,,,JMP,17-Mar-14,,,,TRUE
t13434,17,,1,TRUE,"Not sure where the ""m"" context is coming from; I think it should be ""k,"" although kill never actually seen. GONZ and BSH should be listed in IDs present, and therefore the N ID Hyenas should be 17","In CI's (bshs). Arr, hear ""lots of hyena commotion in the bushes, plus a lion growling. We assume the lion is feeding on a kill."" MALI, BB fat. Nothing seen happening b/w lion(s) and fisi b/c of bshs; only CI's for fisi out of bshs. Ln(s) never seen",TRUE,,,JMP,17-Mar-14,,,,FALSE
t13436,5,1,2,TRUE,,"ad gnu carc-head,spine&ribs. All hyenas but 1 bloody, 1 bldy&fat.As driving up, see ""a big dark-maned lion surrounded by at least 6 hyenas. Lion appears to leave a kill that the hyenas feed on."" Only 5 hys seen when drive up. No CI's 0704-0710 (driving).",TRUE,,,JMP,17-Mar-14,lions,hyenas,feed,FALSE
t135.2,4,2,2,FALSE,ES is referred to as El. [?] (full name I think). Context should be D. starting time 0628,at the beginning hyenas are about 100-150m away from den.,TRUE,,,SSM,11-Jun-14,,,,FALSE
t13536,13,8,3,TRUE,"There are no adult male lions present. Although the obs refers to them as ""2 adult males just growing their manes,"" the fact that they are still growing manes means they are subs. 8 lions total: 2 m subs, 3 clearly subadults, at least 1 ad female.","gnu carcass. Incomplete CI's. Lions fd when arr, 60-80m from the first hyenas seen (maybe some hyenas closer; don't see many of them for a few mins). 1 hyena fat, another bloody. Later in sess really good mating notes, although is a k session",TRUE,,,JMP,17-Mar-14,lions,hyenas,feed,FALSE
t1360,8,,1,TRUE,missing GW,lion/ hyena intx over topi kill. Hyenas made kill. Lions are displaced 200m sw of GW unclear as to who starts with food. @0700 obs moves GW then returns to orginal scene. confusing notes.,TRUE,,,SSM,07-Jul-14,lions,hyenas,feed,FALSE
t1361,2,,2,FALSE,,FAS on KB 1808-1838.lion/s never seen. Hyeans orient to roar. No intx.,TRUE,,,SSM,07-Jul-14,,,,TRUE
t1365,29,2,2,TRUE,Start time is 0723 and end time is 0724(in notes) should be 0728. VD not present,"fig tree hyenas present. 2 kills a zebra, lions at this kill hyenas made kill. (Second kill is gnu with 16 FT hyenas on it.) Lions (young male and adult female) lv scene. Cant find VD in notes. 16+10 unIDs? Then 3 more so 29 hyenas in total. No intx.",TRUE,,,SSM,06-Jul-14,hyenas,lions,feed,TRUE
t1369,8,,2,FALSE,,lion roars not seen. UA [st/lk] S toward the noise. @1756. no intx.,TRUE,,,SSM,06-Jul-14,,,,TRUE
t1373,14,,2,FALSE,missing BW from list,FAS on PP 1806-1848 FAS RG 1838-1848. lion/s only seen not heard. No intx,TRUE,,,SSM,21-Jul-14,,,,TRUE
t1374,21,,1,TRUE,Either PBS or WIT is unID. INT uses full name in notes. CB is culvert boy in notes.,"more than 4 female lions and many younger lions, no adult males. Hyenas bloody but lions have food. Obs says lions stole kill. Notes not detailed as to intx. Nothing recorded. DPS could be WIT",TRUE,,,SSM,06-Jul-14,lions,lions,no,TRUE
t1386,24,2,1,TRUE,"missing GW and HOL. 1 unID and FRO is FRODO or FR in notes, MU is MUT in notes JE is JF in notes. Lions should be subad male","hyenas are bloody lions not, obs says lions stole carc. Gnu carcass. Whitney only noted as whitney? So unID",TRUE,,,SSM,06-Jul-14,lions,both,feed,FALSE
t1388,5,,2,FALSE,,@0624 lions roaring nearby. Never seen. Don’t know age/sex/number. No intx.,TRUE,,,SSM,07-Jul-14,,,,TRUE
t1388.2,5,1,2,TRUE,,Fresh subadult topi [?] (maybe horn or head?). Hyeans lv food.  Male lion come twd ctx. No real intx.,TRUE,,,SSM,07-Jul-14,hyenas,hyenas,feed,TRUE
t1389,7,1,2,FALSE,,hyena bloody and bloated. Handwriting very hard to read. No intx.,TRUE,,,SSM,07-Jul-14,,,,TRUE
t14018,5,1,3,FALSE,Maybe should indicate in UNIDHYENAS that 2 of the aliens are adult females and 3 are adult males,"Obs thinks maybe these unID's are from Southern Hills Clan. ""[The hyenas] are fat & some are interested in a lioness who drinks from a puddle & then lies down."" 1802 three of the hyenas leave, by 1805 the hyenas are all lv - S, lioness still so",TRUE,,,JMP,17-Mar-14,,,,TRUE
t1411,3,,2,FALSE,,"FAS on RV and SB 1836-1856. lions not seen only heard, don’t know age/sex/number.no intx.",TRUE,,,SSM,07-Jul-14,,,,TRUE
t14470.8,10,16,1,TRUE,,"Lion pride sitting in bushes when arr at 0659. Then at 0700, ""hyenas lions jackals gazelles all running like crazy people; [male hyenas] are chasing and have taken down an adult male Grant's gazelle.""",TRUE,,,JMP,17-Mar-14,hyenas,lions,no,FALSE
t14471.4,9,,1,TRUE,,"No interactions specified. Carcass is Grant's gazelle. ""Lion pride"" (no # of lions given) fds on carc when arr, w/RS 60m away and maybe more hyenas initially here, but enormous gaps in the notes. Combies ""take over"" and observer leaves",TRUE,,,JMP,17-Mar-14,lions,lions,no,TRUE
t14480.6,6,1,1,TRUE,"MIG also present; should be listed in IDs present, and N ID Hyenas should be 6","gnu kill (""we don't see the car; just a few scraps; rumen contents on ground here""). ""Adult male lion in [lugga]"", then simple scan of which hyenas are present. One hyena is fat, and one is carrying a scrap. Don't know who st/end w/ food",TRUE,,,JMP,18-Mar-14,,,scraps,TRUE
t14581,1,1,2,FALSE,,"young adult male lion wan/snf, NICK st/lk 60m - lion when arr. No notes for 6 mins, then Nick poops. Session ends w/no more said about lion/lion's whereabouts / what Nick was doing when left, etc.",TRUE,,,JMP,18-Mar-14,,,,TRUE
t14626,3,4,2,FALSE,,"When arr, adult lioness wlk - E, adult male lion on W side of SC roars while wlk E 200m upstream - lioness, another adult male so by SC, 3 unID adult hyenas (can't drive close to ID) flw - 100m lioness",TRUE,,,JMP,18-Mar-14,,,,TRUE
t14632,5,2,2,TRUE,"Only 1 jackal is ever mentioned this session, in the 0751 scan","ad topi k,1 ln fd. ""[appr 2] be [hy k], b/c only head, part of the torso, and [1] leg [left].""JAB v bldy, ft.""Some time after [hys] tore [carc], [lns prob] stole the [k] from them…[prob other ft bldy hys] who left [earlier].""Hys fd carc sps in prior sess",TRUE,,,JMP,18-Mar-14,lions,lions,scraps,FALSE
t1468.1,3,21,2,FALSE,,"hyenas bloody. Cant ID prey. Confusing notes hard to read, 2 groups of lions 11 wed fed lions, 10 boney lions. DJ lope SE near lions but no intx. Hear whooping groaning, and excited zebras.",TRUE,,,SSM,07-Jul-14,,,,TRUE
t14687.2,1,1,3,FALSE,,POS wan/snf 60m - lioness (so),TRUE,,,JMP,18-Mar-14,,,,TRUE
t14743,10,1,3,TRUE,,"Adult lioness so when arr, w/most hyenas st/lk or wan/snf (no distances from lioness given). WR fd ad male tommy head/horns, which is the only food present, and it is only mentioned in the initial scan",TRUE,,,JMP,18-Mar-14,hyenas,hyenas,feed,FALSE
t1480.2,1,5,2,FALSE,,KBK watches a group of lionesses at 30m then they notice him and then circles away and continues to go SE. no intx.,TRUE,,,SSM,07-Jul-14,,,,TRUE
t14802.1,1,1,3,FALSE,"This lion is referred to as a ""lioness,"" so I would change her age from ""unknown"" to ""adult""",GOL wlk downstream 100m - lioness (so). GOL goes oos 3 min later,TRUE,,,JMP,18-Mar-14,,,,TRUE
t14815,3,2,2,TRUE,,"ad topi or gnu k site.""There is a stain on the ground from the rumen contents & one well-chewed lower leg but no other carc parts remain.""Ln/hy distances from k site not given. 2 hys so 150m - lns, 1 hy st/lk 50-100m - ln. 1 hy lv @ end, others & lns so",TRUE,,,JMP,18-Mar-14,none,none,no,TRUE
t14998.1,6,14,2,FALSE,,"No distances from lions given. Almost all hyenas fat, 1 obese & bloody. Most hyenas st/lk, 1 so, 1 (the obese bloody 1) lope arr. Doesn't say what lions are doing. All hyenas wan/snf 15 mins after arr, also when lv. Only mins recorded 0608 and 0623",TRUE,,,JMP,18-Mar-14,,,,TRUE
t15042.2,6,7,3,FALSE,,"Many hyenas fat & bloody. Sub f lion st/lk 20m - hyenas (st/lk, wan/snf, sit/grm). ""…no evidence of any food left.""",TRUE,,,JMP,18-Mar-14,,,,TRUE
t15074.1,3,1,2,TRUE,,"NAV (obese, bloody) fd zebra leg when arr, DYL st/lk 2m - NAV, unIDhyena lurk in bushes. Zebra carcass w/many hyenas ~500m away (session 15074.2)",TRUE,,,JMP,18-Mar-14,hyenas,lions,feed,FALSE
t15089.3,3,,3,TRUE,,"POS bloody. Hyenas so, lions eating zebra carcass 100m - hyenas. Number of lions unk; says ""at least 2"" in predator box because plural (lions) is used",TRUE,,,"JMP

JMP",18-Mar-14,lions,lions,no,TRUE
t15102.2,4,,3,FALSE,,"Hyenas spread out. ""NOTE: lion pride cubs so within 200m [of 2 of the] hyenas."" Number of lion cubs not noted",TRUE,,,JMP,18-Mar-14,,,,TRUE
t15103.1,14,14,3,FALSE,"The two female lions should have their age changed from ""unknown"" to ""adult,"" since they are referred to as ""lionesses"". MALI circled twice in notes (1847 and 1850)","Only 1 lioness here at start. KIP OLY only hyenas present (or at least seen) at start, others arrive. Complete CI sampling ends at 1855",TRUE,,,JMP,18-Mar-14,,,,FALSE
t15106,5,2,2,TRUE,,"When arr, ad m ln fd on fresh ad topi carc. Another m lion lv to SW w/leg. ""we think that these [m lns]stole this [k] frm our [hys], as the [carc] is mostly dismembered and all [hys bloody], not the lions."" BOS also has a leg 250m-carc when arr",TRUE,,,JMP,18-Mar-14,lions,lions,feed,FALSE
t15170,5,1,3,TRUE,"The context for this session should be ""c"" instead of ""m,"" because ""scraps"" are present","Mating scene: SX sexy. Obs follows hyenas, who come upon a young adult male lion at one point. Food not present when lion is; just says at 0711 ""NICK chews scraps."" various combis and FAS on SX and VGS 0733-0806, but not relevant to lion/hyena intx's",TRUE,,,JMP,18-Mar-14,hyenas,hyenas,scraps,FALSE
t1525.3,3,1,1,FALSE,BSH is BRSH in notes.,hyeans so and lioness is present in session. No other information about intx.,TRUE,,,SSM,07-Jul-14,,,,TRUE
t15257.4,1,1,2,FALSE,,"Identity of kill not given. Session is only 1 recorded minute and kill is not mentioned at all really. ""Adult male lion near kill site was chasing JOM…""",TRUE,,,JMP,18-Mar-14,,,,FALSE
t1529.1,8,2,1,FALSE,lions are adults. 0640-0655 is start and end time.,"hyenas are nursing Lions are present in session. No intx. Not much info. HK,MD, TQ, WK are not named but they are cubs and mothers are nursing.",TRUE,,,SSM,07-Jul-14,,,,TRUE
t15304.2,5,1,3,FALSE,,Fisi loping S. 1 hyena (arr from E) is fat,TRUE,,,JMP,18-Mar-14,,,,FALSE
t15357,19,8,3,TRUE,"Predator list: ""1 adult female lion"" + ""7 lg subadult and adult female lions""","adult gnu kill. When arr, 7 lg sub and ad female lions fding carcass, none of them bloody. Many hyenas & 1 ad female lion 100m - kill. By this lion away from the kill, many hyenas ~15-50m away, wan/snf st/lk so wlk. 2 hys fat, 1 obese, 1 slightly bloody",TRUE,,,JMP,18-Mar-14,lions,lions,scraps,FALSE
t15382,4,2,3,TRUE,,"lions sitting by an adult gnu carc when first seen at 0631, 75m - hyenas",TRUE,,,JMP,19-Mar-14,lions,lions,no,TRUE
t15398.4,1,5,2,FALSE,,"Track STG wlk oos into bushes. ""Note: there are 5 lions so here."" No distance from lions given, no age/sex for them given",TRUE,,,JMP,19-Mar-14,,,,TRUE
t15465,29,6,1,TRUE,"There should really only be 14 unIDhyenas, since he observers included ""OLA1"" in the alien count that totaled 15 (he is put in w/ID hyenas as he is seen interacting, is differentiated, and shows up in later sessions). Also, the lions' age should be subad","many hys fat/obese, bldy. Ad m giraffe carc. Hyenas not fd when arr, but obs says ""this carc has been fed upon by hyenas (all fat and bloody) but now 6 young adult male lions…have possession and feed.""15 alien hys here, ""[prob] Olosogon clan"". In CI's",TRUE,,,JMP,19-Mar-14,lions,lions,no,FALSE
t15467.1,22,6,1,TRUE,"Since the lions are referred to as ""young adults,"" their age should be changed to subadult","at same ad m giraffe carc from sess 15465. when arr, ""no one feeds but 6 [m lns] still in area."" Must be same 6 from 15465. No distance from carc/hys given, but sms lns hv poss. Many hy fat/obese. In CI's:""these [hys] are still 1-200m from carc in bushes""",TRUE,,,JMP,19-Mar-14,lions,lions,no,FALSE
t15488,17,8,2,TRUE,"The male lions' age should be changed to subadult. Scraps are very present, so the context should not be ""o"" (I would say ""c""). HOB circled twice in the notes (0605 & 0623).","Arr, ""6 young adult male lions here with/chase hyenas, hyenas whoop and brt"" (see events). 2 hys fat. Food present = scraps, an old piece of gnu skin, gnu ribs, and old bones the hys fd on/squabble over (also see 649 evnt 4 posibl food relevance to lion)",TRUE,,,JMP,19-Mar-14,hyenas,hyenas,scraps,FALSE
t15491.1,2,5,3,FALSE,"The term ""lionesses"" is used to describe the lions, so their age should be changed to ""adult""",Track BERN (fat) wan/snf. PAR wan/snf wlk E. 5 lionesses lv these bushes and wlk NW (no simba distance from fisi given),TRUE,,,JMP,19-Mar-14,,,,TRUE
t15668,19,2,3,TRUE,There are only 2 subadult male lions present this session,"ad gnu carc. Note @ top: ""our [hys] are [v bldy], but a bit [L8r] we see 2 young [m lns fding] on carc [in bshs]...""Many hys ft and/or bldy. In CI's (bushes). Scraps hys fd on=chew on old gnu carc (prob just bones) at 0646. combies arr at 0723 & obs lv",TRUE,,,JMP,20-Mar-14,lions,lions,scraps,FALSE
t15675,5,,3,FALSE,BP circled twice in notes (1804 & 1809),"At start, ""at least 1 male lion"" so. Hyenas get w/in 50m. All fisi so at end, no final distance from lion(s) given",TRUE,,,JMP,20-Mar-14,,,,TRUE
t15682,12,,3,FALSE,"at least one of these lions is a male, no age given (see sess 15675)","same lions as in sess 15675 (later same evening; since plural used here, were prob >1 lion in 15675 too). Lions so 20-150m - hyenas, who are so except GONZ (wlk N) & NICK (wan/snf)",TRUE,,,JMP,20-Mar-14,,,,TRUE
t1569.3,16,9,2,TRUE,,FAS on Q 0658-1028.  hyena bloody. Buffalo kill at ost. Knoll. Hyenas get lung and small scraps. Many alien hyenas present.,TRUE,,,SSM,07-Jul-14,lions,lions,scraps,FALSE
t15703,7,3,3,TRUE,"WHO and HEM should be included in IDs present (see note b/w 0726 and 0727), making the N ID Hyenas 7","ad gnu carc. 2 hys fat, 1 bloody, 2 fat/obese & bloody. Only 5 hys by carc, 2 seen wlk further away. Lioness w/2 little cubs so ~50m downstream - feeding hyenas",TRUE,,,JMP,20-Mar-14,hyenas,hyenas,feed,TRUE
t15756,18,1,3,TRUE,,"in CI's @ least @ st (IDing) due to #fisi. ""site of [ad gnu k] (and subad gnu carc)""…2 carcasses, seems are by/very near one another. Young adult m lion so 50m - k when arr, no more said about him. 3 hys bldy, 2 obese, 1 obese & bldy. Baiting 0659-0706",TRUE,,,JMP,20-Mar-14,hyenas,hyenas,feed,TRUE
t15766,22,2,3,TRUE,"OKE and LG should both be included in IDs present, and therefore the N ID Hyenas should be 22","""2 [ad m lns hv] apparently stolen an [ad] gnu carc from [hys],"" although no hys noted as bloody (mybe due to it just getting light?), & only 2 fat. No dis from carc/lns given. Likely In CI's(?)due to #hys. Several indiv whoops, only rec when >1 same min",TRUE,,,JMP,20-Mar-14,lions,lions,no,TRUE
t1578.1,5,9,1,FALSE,OT not PT present. VD is vdot in notes.,@1738 9 lions arr from NE don’t know age/sex/number of each. Not other inforamtion. No intx.,TRUE,,,SSM,07-Jul-14,,,,TRUE
t15821,2,5,3,FALSE,"The start time for this session should read 6:52, and the end time should be 6:57. 1 of the lions is an adult female (the one who chases KIP at 0653 is referred to as a ""lioness"")","When arr, WHO (fat) st/lk 20m - lioness (so), and KIP (also fat) st/lk 40m - same lioness (so). ""at least 4 more lions"" 100m - hyenas. Num lions = minimum",TRUE,,,JMP,20-Mar-14,,,,FALSE
t15881,3,1,3,TRUE,"The end time for this session should read 6:09.The unIDhyena is referred to as ""alien/FT hyena,"" so it should not be marked as certainly a FT hyena in the unIDhyenas.Maybe more than 1 lion (see 0601, where plural used in location line). The F lion = adult","@Talek gat. Lioness has poss of zeb carc in rivbed. No intial distances from ln given. TZ bldy wan/snf, GONZ st/lk by gate, alien/FT hyena wan/snf in rivbed. Psbly >1 lion, b/c says ""site of lions on [z carc],"" although ""1 [ln] has poss."" Seems only 1 tho",TRUE,,,JMP,20-Mar-14,lions,lions,no,FALSE
t1589,2,1,2,FALSE,MU is MUT in notes.,FAS on MU and RCN 0644-800. lion is bulging possibly eaten in Slp crk. No real intx.,TRUE,,,SSM,07-Jul-14,,,,TRUE
t1598,5,1,2,TRUE,,hyena bloody. FAS on INT 1728-1834. freshly killed adult topi. . 10 combies around.,TRUE,,,SSM,07-Jul-14,hyenas,lions,feed,FALSE
t1602.1,14,7,2,TRUE,end time is 1838.,more than 7 lions don’t know age/sex/or number of each. Fas MU 1740-1820. FAS SH 1830-1838.  buffalo carc. One hyena has buffalo leg.,TRUE,,,SSM,07-Jul-14,lions,lions,scraps,TRUE
t1603.1,18,1,2,TRUE,"SHER is SH in notes, MU is MUT in notes",FAS on SHER 0634-0815. notes say male lion is adult but young. Buffalo carcass. Combies here scaring hyenas.,TRUE,,,SSM,08-Jul-14,hyenas,hyenas,feed,FALSE
t1605,19,5,2,TRUE,HOL never IDed without ? So 1 unID also big red muddy male is unID. unID=2. lions are subadult.,"adult topi kill. Hyenas are bloody, obs thinks kill made by hyenas. Lions are all nearly full grown do not know sex. FAS on EN 1632-1820 FAS on INT 1632-1832 FAS on SY 1632-1900 .  combies here scaring hyenas.",TRUE,,,SSM,08-Jul-14,lions,hyenas,feed,FALSE
t1612,1,9,2,TRUE,,adult topi kill. 9 big adults and subadult lions don’t know sex or how many of each. Int rushes a jackal and steals a rib from him then eats it. No intx.,TRUE,,,SSM,08-Jul-14,lions,lions,scraps,TRUE
t1625,6,4,2,FALSE,,1 male and 3 female adult lions so 100m NE of hyenas. No intx,TRUE,,,SSM,08-Jul-14,,,,TRUE
t1627,15,7,2,TRUE,"MU is MUT in notes, ans Quai is Quail in notes.",subadult gnu carcass not much left only head and some skin. Neither lions or hyenas are bloody.  FAS  Q 0607-0705. FAS on MU 0607-0710.  lions are subadult don’t know gender,TRUE,,,SSM,08-Jul-14,lions,hyenas,feed,FALSE
t16309,13,1,3,TRUE,"GOB circled twice in notes (0633 and 0652). Female lion referred to as ""lioness,"" so her age should be changed to ""adult""","Flw 3 fat bloody hys to where are other hys, then eventually flw most to where a lioness fd on head of subad gnu. 4 other hys in session fat-obese",TRUE,,,JMP,20-Mar-14,lions,hyenas,feed,FALSE
t1636.1,1,11,2,TRUE,end time 6:45,adult giraffe kill made by lions. 3 adult females and 8 cubs. No other info given. No intx,TRUE,,,SSM,08-Jul-14,lions,lions,no,TRUE
t1637.1,1,11,2,TRUE,,same lions from 1636.1 probably. So 3 adult females and 8 cubs. =11 lions. Zip is so 50m N of carcass. No intx. Lions fd.,TRUE,,,SSM,08-Jul-14,lions,lions,no,TRUE
t1638,1,,2,TRUE,MU is MUT in notes,"giraffe carcass. 3 adult lionesses,2  big male lions, and babies are presents. So 7 adult lions in session present but don’t know how many babies. @0651 topi chases MU. No real intx.",TRUE,,,SSM,08-Jul-14,lions,lions,no,TRUE
t16391,15,9,2,TRUE,"There should be 3 young adult male lions recorded, 2 which are here at the beginning and wlk - S, and then 1 more is with the 6 lionesses downstream at 0607 (possible one of same, but don't think downstream=south). Term ""lionesses"" is used, so 6 f age=ad","""2 young male lions here at what looks like site of carcass (blood stained ground)."" No distances from lions/carc site given. In CI's. Many hyenas bloody and/or fat/obese",TRUE,,,JMP,20-Mar-14,,hyenas,feed,FALSE
t16441,1,1,3,FALSE,,"Track BAIL (fat) wlk N oos into SRL, ""young male lion so here."" no distance from BAIL given. Only 1 min recorded",TRUE,,,JMP,20-Mar-14,,,,TRUE
t1651.2,1,1,2,TRUE,,"adult gnu kill sher is lving as obs arr. Bloody face, very fat. Deep in fig tree range",TRUE,,,SSM,08-Jul-14,hyenas,none,feed,FALSE
t16522,3,,3,TRUE,,"3 hyenas (2 st/lk, 1 fd scrap) 150m - lions. ""Note: 150m NE are lions feeding on gnu carcass."" No number of lions given. Combies arr 1811 and at least 2 fisi go oos. Only recorded mins = 1810-11.",TRUE,,,JMP,20-Mar-14,lions,lions,scraps,TRUE
